"Composition of Composable Cellular Automata with respect to their dimensional attributes","G. R. Mayer","Department of Computer Science, Southern Illinois University Edwardsville, 61 Circle Drive, 62026, USA","2016 Symposium on Theory of Modeling and Simulation (TMS-DEVS)","4 May 2017","2016","","","1","8","The Composable Cellular Automata (CCA) specification, introduced in a previous article, formally defines a system for building cellular automata models that can be composed with other models. The purpose is to build hybrid simulation models of large, complex systems with uniquely modeled subsystems. Multiple subsystems of a hybrid model may implement the CCA specification. For the purposes of refining domain abstraction, reducing composition complexity, or improving model execution, these CCA may first be composed with each other to reduce the number of CCA models. A modeler must understand the impact that disparities between CCA may have on the potential composition. To that end, this paper builds upon the original publication to describe closure properties of formal composition of CCA with respect to their dimensional attributes-cell indices and time. From this, CCA can be composed and treated as a single CCA; thus reducing the overall complexity of the hybrid model.","","978-1-5108-2321-1","10.23919/TMS.2016.7918832","","https://ieeexplore-ieee-org.libraryproxy.his.se/stamp/stamp.jsp?arnumber=7918832","Composable Cellular Automata;hybrid;multi-formalism;composability","Automata;Complexity theory;Agriculture;Computational modeling;Software;Meteorology;Interoperability","cellular automata;computational complexity","composable cellular automata;dimensional attributes;CCA specification;hybrid simulation model;large-complex systems;domain abstraction;composition complexity reduction;model execution improvement;formal composition;cell index attribute;time attribute;hybrid model complexity reduction","","","","13","","4 May 2017","","","IEEE","IEEE Conferences"
"Reverse Engineering Abstract Components for Model-Based Development and Verification of Embedded Software","Y. Choi; H. Jang","Sch. of Comput. Sci. & Eng., Coll. of IT Kyungpook Nat. Univ., Daegu, South Korea; Sch. of Comput. Sci. & Eng., Coll. of IT Kyungpook Nat. Univ., Daegu, South Korea","2010 IEEE 12th International Symposium on High Assurance Systems Engineering","11 Nov 2010","2010","","","122","131","Model-driven development (MDD) and verification approaches are highly desirable in the development of (safety-critical) embedded systems, since they help to identify functional or non-functional issues from the early development stage when verification complexity is relatively lower than that of the implemented systems. Nevertheless, MDD approaches have not been widely adopted in practice mainly due to the difficulty and high initial cost of switching the development paradigm from code-centric to model-driven. This work presents a systematic method for reverse engineering abstract models from embedded codes using the notion of abstract components which act as independent units of development, validation, and verification. The recursive reverse engineering process constructs high-level abstract components from low-level ones using synchronized abstraction and projection abstraction, defined w.r.t. the information on port dependency and port bindings. This approach is demonstrated with reverse-engineered TinyOS, where each abstract component is validated and verified using model simulation and model checking.","1530-2059","978-1-4244-9091-2","10.1109/HASE.2010.20","","https://ieeexplore-ieee-org.libraryproxy.his.se/stamp/stamp.jsp?arnumber=5634316","Reverse-engineering;component;abstraction","Synchronization;Reverse engineering;Radiation detectors;Systematics;Switches;Embedded systems;Manuals","embedded systems;program verification;reverse engineering;safety-critical software","reverse engineering;high-level abstract component;model-based development;embedded software verification;MDD;safety-critical embedded system;synchronized abstraction;projection abstraction;TinyOS;model simulation;model checking","","","","28","","11 Nov 2010","","","IEEE","IEEE Conferences"
"Meta-model Design for Internet Multimedia Neurophysiology Interface","A. P. Kamyshanov","Accounting & Audit Dept., Plekhanov Russian Economic Acad., Moscow","2009 Third Asia International Conference on Modelling & Simulation","12 Jun 2009","2009","","","632","636","Internet modelling research has worked out its own problem domain. It unites the results and methods of fundamental sciences as physics, chemistry, and quantum mechanics, so exotic mathematically poor described neurophysiology together with rapidly developing knowledge engineering. Global scientistspsila cooperation leads to creation of multimedia systems, representing Internet cognitive interface, and new theoretical methods for knowledge discovery. Hidden Markov chains with complex topology are important theoretical base stone of knowledge discovery technology. Research meta-model with hidden Markov chain for Internet multimedia interface is suggested. On the base of Internet modelling the approach for quantum mechanics and information theory logic monotony knowledge fusion was suggested. It was demonstrated for uncertainty relation of quantum mechanics and Shannon information measure by applying lifting lemma to Internet modelling domain, that logic monotony of Internet knowledge base had been preserved.","2376-1172","978-1-4244-4154-9","10.1109/AMS.2009.31","","https://ieeexplore-ieee-org.libraryproxy.his.se/stamp/stamp.jsp?arnumber=5072060","Hidden Markov chains;Internet modelling;uncertainty relation of quantum mechanics","Internet;Neurophysiology;Hidden Markov models;Quantum mechanics;Logic;Physics;Chemistry;Knowledge engineering;Multimedia systems;Topology","data mining;hidden Markov models;Internet;multimedia systems;neurophysiology","Internet multimedia neurophysiology interface;meta-model design;knowledge engineering;multimedia systems;Internet cognitive interface;knowledge discovery;hidden Markov chains;quantum mechanics;information theory logic;monotony knowledge fusion;Shannon information measure","","","","34","","12 Jun 2009","","","IEEE","IEEE Conferences"
"A simplified model for V-ATPase H/sup +/ extrusion","Chuan Luo; J. W. Clark; T. A. Heming; A. Bidani","Dept. of Electr. & Comput. Eng., Rice Univ., Houston, TX, USA; NA; NA; NA","IEEE Transactions on NanoBioscience","6 Dec 2004","2004","3","4","257","264","An analytical model of V-type H/sup +/-translocating ATPase (V-ATPase) was developed based on an approximation to the mechanochemical model of Grabe et al. (Biophys. J., pp. 2798-2813, vol. 78, 2000). Grabe's work utilizes structural information and physiological assumptions to construct a detailed mechanochemical model of the V-ATPase. Due to the complexity of their model, it does not give a readily usable mathematical expression for the V-ATPase current. Based on their analysis of the structure of the proton pump, we develop a two-compartment model of the V-ATPase, which contains a membrane ""half-channel"" for proton translocation separated by a hydrophilic strip and a hydrophobic wall from the cytoplasm. Using the Langevin equation to describe proton transport across the membrane, we simplify the model based on their assumptions on the molecular structure of the pump and arrive at a general form of solution to the proton pump flux driven by ATP hydrolysis based on assumptions on the physiological properties of the strip and the wall, as well as the two fluid compartments. In this process of simplification, we explicitly relate V-ATPase structure, stoichiometry, pump efficiency, and ATP hydrolysis energy to the active pump current. The simplified model is used to provide model-generated approximations to measured data from a variety of laboratories. In addition, it provides a very compact characterization of V-ATPase, which can be used as a proton extruder in a variety of different cell membranes, as well as in the membranes of intracellular organelles.","1558-2639","","10.1109/TNB.2004.837905","","https://ieeexplore-ieee-org.libraryproxy.his.se/stamp/stamp.jsp?arnumber=1363984","Electrophysiology;mechanochemstry;molecular motors;proton extrusion","Protons;Couplings;Rotors;Plasma measurements;Biomembranes;Stators;Torque;Extracellular;Micromotors;Biochemistry","physiological models;biomembrane transport;bioelectric phenomena;proteins;molecular biophysics;biochemistry","V-ATPase H/sup +/ extrusion;V-type H/sup +/-translocating ATPase;mechanochemical model;proton pump;two-compartment V-ATPase model;membrane half-channel;proton translocation;cytoplasm;Langevin equation;pump molecular structure;ATP hydrolysis;active pump current;cell membranes;intracellular organelles;H","Biological Transport, Active;Computer Simulation;Models, Biological;Models, Chemical;Molecular Motor Proteins;Molecular Motor Proteins;Proton Pumps;Proton Pumps;Protons;Vacuolar Proton-Translocating ATPases;Vacuolar Proton-Translocating ATPases","3","","14","","6 Dec 2004","","","IEEE","IEEE Journals"
"A metamodel-based optimization method for mobile ad hoc networks","Chen Ling; Liang Jia-hong; Wu Bing; Hu Zhi-wei","School of Mechatronics Engineering and Automation, National University of Defense Technology, Changsha, China; School of Mechatronics Engineering and Automation, National University of Defense Technology, Changsha, China; School of Mechatronics Engineering and Automation, National University of Defense Technology, Changsha, China; School of Mechatronics Engineering and Automation, National University of Defense Technology, Changsha, China","2010 International Conference on Computer Application and System Modeling (ICCASM 2010)","4 Nov 2010","2010","12","","V12-412","V12-416","To address the dilemma between the accuracy of simulation-model and runtime efficiency which take place in the simulation-based optimization of mobile ad hoc networks, the metamodel-based optimization methodology is investigated to optimize the performance of networks. Hybrid optimization strategy is proposed in detail, which integrated Kriging metamodel, evolution algorithm and trust region algorithm. With this optimization strategy, a nonlinear parameter settings optimization problem is resolved. The results show, the proposed metamodel-based optimization strategy can improve the efficiency of computation-intensive process, it can be successfully applied to the domain of complex systems such as mobile ad hoc networks, facilitating system modeling, analysis and optimization.","2161-9077","978-1-4244-7237-6","10.1109/ICCASM.2010.5622333","","https://ieeexplore-ieee-org.libraryproxy.his.se/stamp/stamp.jsp?arnumber=5622333","Metamodel-based Optimization;Kriging;Evolution algorithm;Trust-region algorithm","Optimization;Computational modeling;Mobile ad hoc networks;Mathematical model;Metamodeling;Accuracy","ad hoc networks;mobile radio;optimisation;statistical analysis","mobile ad hoc networks;metamodel-based optimization;hybrid optimization;integrated Kriging metamodel;evolution algorithm;trust region algorithm;nonlinear parameter;complex systems","","","","14","","4 Nov 2010","","","IEEE","IEEE Conferences"
"Poster Abstract: Unifying Modeling Substrate for Irrigation Cyber-Physical Systems","D. Hovhannisyan; F. Kurdahi; A. Eltawil; A. Aghakouchak; M. A. Al Faruque","Univ. of California, Irvine, Irvine, CA, USA; Univ. of California, Irvine, Irvine, CA, USA; Univ. of California, Irvine, Irvine, CA, USA; Univ. of California, Irvine, Irvine, CA, USA; Univ. of California, Irvine, Irvine, CA, USA","2016 ACM/IEEE 7th International Conference on Cyber-Physical Systems (ICCPS)","26 May 2016","2016","","","1","1","CPS's multi-domain nature is difficult to capture using existing modeling approaches, which produce compartmentalized and complex system simulation models. Unifying models of multi-domain physical phenomena and processes, and man-made artifacts into a single modeling substrate will enable enhanced design of intelligent control algorithms and analytics. Moreover, with use of known modeling abstractions, which describe the physical ordinary differential equation (ODE) relationships by introducing model components, such as those found in Electronic Design Automation (EDA) tools, models of the physical world, e.g. irrigation systems, integrated with models of cyber world, e.g. electrical circuits, can be analyzed using existing tools. This can be done by using analogies between hydraulic, electrical, mechanical, etc. For example, we developed soil moisture transient electrical circuit model for the next generation of Irrigation CPS. The most important component in smart irrigation system design are the knowledge of water transport in the soil, or percolation, and water uptake by plants or transpiration and evaporation, or combined evapotranspiration (ET). Main analytical ODEs that describe water transport in soil are Richard's Equation: ∂θ/∂t =(∂θ/∂z) [K(θ)(( ∂ψ/∂z) + 1)] and Darcy's Law: q = K(ψ)∇ψ, where θ is water content, K is the hydraulic conductivity, z is the elevation, t is time, ψ is the pressure head or water potential, q is the flux or the discharge per square area. However, these equations do not have closed form solutions, thus, we chose to model and simulate the phenomena using electrical circuit components. To expose the underlying soil physics, we modeled vertical segment of soil by layers of water storage, or capacitive, and transport, or resistive, components. Starting with a single layer of storage, model is tuned and evolved. At each successful stage of evolution, a storage component is divided into two storage elements and connected by a transport component. Meanwhile, model parameters are tuned by quadratic optimization with respect to experimental data split into training and validation segments, which were gathered from outdoor soil moisture sensor in a 16 day duration with 15 min sampling period. Finally, experimental results show that model order 3 has the best fit of experimental data with R2 = 0.923. Thus, this ODE based simulation methodology describes transient behavior of vertical moisture transport in soil, and enables CPS model- based design and control.","","978-1-5090-1772-0","10.1109/ICCPS.2016.7479116","","https://ieeexplore-ieee-org.libraryproxy.his.se/stamp/stamp.jsp?arnumber=7479116","","Mathematical model;Analytical models;Irrigation;Substrates;Soil moisture;Transient analysis","cyber-physical systems;irrigation;water storage","modeling substrate;irrigation cyber-physical systems;CPS multidomain nature;compartmentalized;complex system simulation models;multidomain physical phenomena;man-made artifacts;intelligent control algorithms;physical ordinary differential equation;ODE relationships;model components;electronic design automation;EDA tools;soil moisture transient electrical circuit model;irrigation CPS;smart irrigation system design;water transport;percolation;water uptake;evapotranspiration;ET;Darcy law;water content;hydraulic conductivity;electrical circuit components;water storage","","1","","","","26 May 2016","","","IEEE","IEEE Conferences"
"Metamodel applications using TERSM","M. A. Zeimer; J. D. Tew","ISQ Dept., Consolidated Freightways Inc., Portland, OR, USA; ISQ Dept., Consolidated Freightways Inc., Portland, OR, USA","Winter Simulation Conference Proceedings, 1995.","6 Aug 2002","1995","","","1421","1428","Tactical simulation models are often used to assess vulnerabilities and capabilities of combat systems and doctrines. Due to the complexity of tactical simulation models, it is often difficult to assess the relationship between input factors and the performance of the simulation model. To facilitate this type of assessment, simulation analysts often use the simulation model to empirically construct a black-box approximation of the causal and time dependent behavior of the simulation model. This type of approximation is known as a metamodel and can be viewed as a summary of the behavior of the simulation model. We demonstrate this technique in the context of an example using TERSM (Tactical Electronic Reconnaissance Simulation Model). The results indicate that metamodeling is applicable to tactical simulation models and that the technique has a wide range of uses.","","0-78033018-8","10.1109/WSC.1995.479056","","https://ieeexplore-ieee-org.libraryproxy.his.se/stamp/stamp.jsp?arnumber=479056","","Polynomials;Analytical models;Metamodeling;Least squares approximation;Context modeling;Least squares methods;Power system modeling;Reconnaissance;Statistical analysis;Analysis of variance","digital simulation;military computing","TERSM;complexity;tactical simulation models;combat systems;black-box approximation;simulation model;metamodeling;metamodel","","1","","11","","6 Aug 2002","","","IEEE","IEEE Conferences"
"On Using Clustering for the Optimization of Hydrological Simulations","E. Azmi","Steinbuch Centre for Comput., Karlsruhe Inst. of Technol., Karlsruhe, Germany","2018 IEEE International Conference on Data Mining Workshops (ICDMW)","10 Feb 2019","2018","","","1495","1496","Accurate water-related predictions and decision-making require a simulation of hydrological systems in high spatio-temporal resolution. However, the simulation of such a large-scale dynamical system is compute-intensive, and hence time consuming. One approach to circumvent these issues is to use landscape properties to reduce model redundancies and computation complexities. This work shows an ongoing project that applies existing clustering methods to identify functionally similar model units and runs the model only on representative model units. The proposed approach consists of several steps, in particular the reduction of dimensionality of the hydrological time series, application of clustering methods, choice of cluster representative, and study of the balance between the uncertainty of the simulation output and the computational effort.","2375-9259","978-1-5386-9288-2","10.1109/ICDMW.2018.00215","","https://ieeexplore-ieee-org.libraryproxy.his.se/stamp/stamp.jsp?arnumber=8637502","Simulation;Optimization;Clustering;Time series","Computational modeling;Containers;Time series analysis;Atmospheric modeling;Data models;Clustering methods;Predictive models","computational complexity;decision making;geophysics computing;hydrological techniques;hydrology;pattern clustering;redundancy;time series","cluster representative;simulation output;computational effort;hydrological simulations;hydrological systems;high spatio-temporal resolution;large-scale dynamical system;time consuming;landscape properties;model redundancies;computation complexities;ongoing project;clustering methods;functionally similar model units;representative model units;hydrological time series","","","","10","","10 Feb 2019","","","IEEE","IEEE Conferences"
"Simplified modeling and simulation for physical systems circuit design on a multiphysics software exportable to a multi-domain platform","E. N. Vázquez-Acosta; M. A. Reyes-Barranca; S. Mendoza-Acevedo; J. L. González-Vida","CINVESTAV-IPN, Electrical Engineering Dept., Mexico D.F., Mexico; CINVESTAV-IPN, Electrical Engineering Dept., Mexico D.F., Mexico; CINVESTAV-IPN, Electrical Engineering Dept., Mexico D.F., Mexico; UAEH, Pachuca, Hidalgo, Mexico","2010 7th International Conference on Electrical Engineering Computing Science and Automatic Control","25 Oct 2010","2010","","","525","530","Simulation software is a fundamental tool that should be used when designing systems dealing with electro-thermal interaction, for instance. Nevertheless, there exist some inconveniences that limit and make specific software hard to use in this task. On one side, it may require a large processing hardware capacity, and on the other, simulation time increases substantially if the model complexity and accuracy required is high. This work presents the procedure for modeling and simulating a micro-electro-mechanical system (MEMS) operating with an electro-thermal interaction and implemented with the help of a multi-domain design and simulation platform based on dynamic systems (Simulink® of Matlab®), using the results obtained after several simulations made with a finite elements analysis and engineering software environment, in particular, for simulation and modeling the physical behavior of the system's elements (COMSOL Mutiphysics®). The main goal of this study is to show a highly convenient alternative from which simulation time can be shortened with reduced hardware requirements, allowing at the same time the outline of possible electronic temperature control blocks, so it can be integrated on a silicon chip.","","978-1-4244-7314-4","10.1109/ICEEE.2010.5608593","","https://ieeexplore-ieee-org.libraryproxy.his.se/stamp/stamp.jsp?arnumber=5608593","MEMS;modeling;simulation;temperature control","Solid modeling;Mathematical model;Integrated circuit modeling;Analytical models;Software;Equations;Computational modeling","digital simulation;electronic design automation;electronic engineering computing;finite element analysis;micromechanical devices;physics computing","physical systems circuit design;multiphysics software;multidomain platform;simulation software;electro thermal interaction;micro electro mechanical system;dynamic systems;finite elements analysis;engineering software environment;COMSOL Mutiphysics®;electronic temperature control blocks;silicon chip","","","","6","","25 Oct 2010","","","IEEE","IEEE Conferences"
"Modeling of shift hydraulic system for automatic transmission","G. Tao; T. Zhang; H. Chen","School of Mechanical Engineering, Beijing Institute of Technology, Beijing, China; School of Mechanical Engineering, Beijing Institute of Technology, Beijing, China; School of Mechanical Engineering, Beijing Institute of Technology, Beijing, China","2011 International Conference on Consumer Electronics, Communications and Networks (CECNet)","16 May 2011","2011","","","474","477","The main functions of the shift hydraulic system for stepped automatic transmission are to generate and maintain desired clutch pressures for shifting operation, as well as to initiate gear shifts and control shift quality. It consists of supply line pressure regulation system, solenoid valve, pressure control valve (PCV), and wet clutch. This paper presents a dynamic model of the shift control system and conducts simulation based on AMESim software. The simulation model is then validated against experimental data. Because the model derived is complex, highly nonlinear and high order, which is not suitable for use in controller, the model simplification is carried out based on an energy-based model order reduction method. The results confirm that simulation analysis with AMESim can predict hydraulic system dynamic response accurately and the model simplification is instructive for controller design.","","978-1-61284-459-6","10.1109/CECNET.2011.5768674","","https://ieeexplore-ieee-org.libraryproxy.his.se/stamp/stamp.jsp?arnumber=5768674","shift hydraulic system;AMESim simulation;modeling simplificaiton;activity index","Valves;Mathematical model;Solenoids;Pressure control;Pistons;Indexes","clutches;dynamic response;gears;hydraulic systems;mechanical engineering computing;power transmission (mechanical);pressure control;quality control;solenoids;valves","shift hydraulic system;stepped automatic transmission;clutch pressures;gear shifts;shift quality control;supply line pressure regulation system;solenoid valve;pressure control valve;wet clutch;AMESim software;energy-based model order reduction;dynamic response;controller design","","5","","5","","16 May 2011","","","IEEE","IEEE Conferences"
