"Model reduction for linear parameter-varying systems through parameter projection","S. Schouten; D. Lou; S. Weiland","Eindhoven University of Technology,Department of Electrical Engineering,Eindhoven,The Netherlands; Eindhoven University of Technology,Department of Electrical Engineering,Eindhoven,The Netherlands; Eindhoven University of Technology,Department of Electrical Engineering,Eindhoven,The Netherlands","2019 IEEE 58th Conference on Decision and Control (CDC)","12 Mar 2020","2019","","","7800","7805","For affine linear parameter-varying (LPV) systems, this paper develops two parameter reduction methods for reducing the dimension of the parameter space. The first method achieves the complexity reduction by transforming the affine LPV system into a parameter-ordered form and establishing an affine upper bound of the system Gramians, which is extended to time-varying rate-bounded parameters. The second method is based on considering the sensitivity function of the transfer function and time evolution equations. Both methods are applied to a thermal model. Simulation results together with some analysis are given.","2576-2370","978-1-7281-1398-2","10.1109/CDC40024.2019.9029318","","https://ieeexplore-ieee-org.libraryproxy.his.se/stamp/stamp.jsp?arnumber=9029318","","Mathematical model;Upper bound;Transfer functions;Linear systems;Computational modeling;Integrated circuit modeling;Observability","linear parameter varying systems;reduced order systems;transfer functions","time-varying rate-bounded parameters;transfer function;time evolution equations;model reduction;parameter projection;affine linear parameter-varying systems;parameter reduction methods;complexity reduction;affine LPV system;parameter-ordered form;system Gramians","","","","19","","12 Mar 2020","","","IEEE","IEEE Conferences"
"Influence of Car Body Modeling on the Gain Patterns of Automotive Antennas","J. Singh; A. Asgharzadeh; R. Stephan; M. A. Hein","RF & Microwave Res. Lab., Tech. Univ. Ilmenau, Ilmenau, Germany; RF & Microwave Res. Lab., Tech. Univ. Ilmenau, Ilmenau, Germany; RF & Microwave Res. Lab., Tech. Univ. Ilmenau, Ilmenau, Germany; RF & Microwave Res. Lab., Tech. Univ. Ilmenau, Ilmenau, Germany","2017 IEEE 85th Vehicular Technology Conference (VTC Spring)","16 Nov 2017","2017","","","1","5","It has been observed through simulations that an automotive antenna has a complex electromagnetic interaction with the body of the car, and thus cannot be treated independently from the car. This is especially true at wavelengths that are comparable to the dimensions of the car, for example, at the FM wavelengths considered in this paper. In such cases, variations of the design/geometrical structure of the car can lead to significant changes of the surface currents on the car chassis, which then contribute differently to the far-field pattern. On the other hand, full- wave simulations of exact car models suffer from the challenges of large computational power and simulation time requirement due to the extremely large number of mesh cells. In lieu of this fact, this paper analyzes strategies that appear appropriate for complexity reduction of a high- complexity car model, while maintaining a sufficient degree of similarity between the far- field results of the original model and its reduced counterpart. This would ease the requirement for large computational power and simulation time. At the same time, the equivalent reduced model could be beneficially used for further electromagnetic studies of the car, or for designing new types of antennas properly integrated into the car.","","978-1-5090-5932-4","10.1109/VTCSpring.2017.8108214","","https://ieeexplore-ieee-org.libraryproxy.his.se/stamp/stamp.jsp?arnumber=8108214","","Automobiles;Solid modeling;Antennas;Computational modeling;Gain;Analytical models;Automotive components","antenna radiation patterns;automobiles;automotive components;mesh generation;mobile antennas","complex electromagnetic interaction;car chassis;exact car models;simulation time requirement;high- complexity car model;car body modeling;automotive antennas;FM wavelengths;far-field pattern;computational power;complexity reduction;gain patterns","","","","10","","16 Nov 2017","","","IEEE","IEEE Conferences"
"Machine Learning based Simulation Optimisation for Trailer Management","D. Rijnen; J. Rhuggenaath; P. R. d. O. d. Costa; Y. Zhang","AB InBev,Belgium; Eindhoven University of Technology,The School of Industrial Engineering,The Netherlands; Eindhoven University of Technology,The School of Industrial Engineering,The Netherlands; Eindhoven University of Technology,The School of Industrial Engineering,The Netherlands","2019 IEEE International Conference on Systems, Man and Cybernetics (SMC)","28 Nov 2019","2019","","","3687","3692","In many situations, simulation models are developed to handle complex real-world business optimisation problems. In our case, a discrete-event simulation model is used to simulate trailer management and fleet configuration in a big Fast-Moving Consumer Goods company. To address the problem of finding suitable simulation inputs for optimisation, we propose a simulation optimisation approach. The simulation optimisation model combines metaheuristic search (genetic algorithm), with an approximation model filter (feed-forward neural network) to optimise the input configuration of the simulation model. In this work, we introduce an ensure probability that overrules the rejection of potential solutions by the approximation model and demonstrate its effectiveness. In addition, we evaluate the impact of the genetic algorithm parameters and show how population size, filter threshold, and mutation probability impact overall fleet optimisation performance. Lastly, we compare the proposed method with a single global approximation model and a random-based approach, our results demonstrate the advantage of our method in terms of computational time and solution quality.","2577-1655","978-1-7281-4569-3","10.1109/SMC.2019.8914329","","https://ieeexplore-ieee-org.libraryproxy.his.se/stamp/stamp.jsp?arnumber=8914329","","Optimization;Genetic algorithms;Mathematical model;Sociology;Statistics;Computational modeling;Linear programming","discrete event simulation;feedforward neural nets;genetic algorithms;goods distribution;learning (artificial intelligence);probability;production engineering computing;search problems","trailer management;real-world business optimisation problems;discrete-event simulation model;fleet configuration;suitable simulation inputs;simulation optimisation approach;simulation optimisation model;metaheuristic search;approximation model filter;feed-forward neural network;input configuration;genetic algorithm parameters;fleet optimisation performance;single global approximation model;big fast-moving consumer goods company","","","","16","","28 Nov 2019","","","IEEE","IEEE Conferences"
"Study on fast model predictive controllers for large urban traffic networks","S. Lin; B. De Schutter; Y. Xi; H. Hellendoorn","Department of Automation, Shanghai Jiao Tong University, Shanghai, P. R. China; Delft Center for Systems and Control, Delft University of Technology, The Netherlands; Department of Automation, Shanghai Jiao Tong University, Shanghai, P. R. China; Delft Center for Systems and Control, Delft University of Technology, The Netherlands","2009 12th International IEEE Conference on Intelligent Transportation Systems","6 Nov 2009","2009","","","1","6","Traffic control is both an efficient and effective way to alleviate the traffic congestion in urban areas. Model predictive control (MPC) has advantages in controlling and coordinating urban traffic networks. But, the real-time computational complexity of MPC increases exponentially, when the network scale and the predictive time horizon grow. To improve the real-time feasibility of MPC, a simplified macroscopic urban traffic model is developed. Two MPC controllers are built based on the simplified model and a more detailed model. Simulation results of the two controllers show that the online optimization time is reduced dramatically by applying the simplified model, only losing a limited amount of control effectiveness. Additional techniques, like applying a control time horizon and an aggregation scheme, are implemented to reduce the computational complexity further. Simulation results show positive effects of these techniques.","2153-0017","978-1-4244-5519-5","10.1109/ITSC.2009.5309773","","https://ieeexplore-ieee-org.libraryproxy.his.se/stamp/stamp.jsp?arnumber=5309773","","Predictive models;Communication system traffic control;Traffic control;Computational complexity;Marine technology;Computational modeling;Optimization methods;Detectors;Intelligent transportation systems;Urban areas","computational complexity;predictive control;road traffic;traffic control","model predictive controller;urban traffic network;traffic control;traffic congestion alleviation;computational complexity;MPC;macroscopic urban traffic model;time horizon;road traffic","","8","","11","","6 Nov 2009","","","IEEE","IEEE Conferences"
"High Fidelity Simulation Models for Accurate Equipment Performance Prediction","Y. H. Yeam; A. Ali; Y. E. Peng; L. W. Fun; S. Mohideen","Bayan Lepas Free Ind. Zone, Penang; Intel Technology Sdn. Bhd, Bayan Lepas Free Industrial Zone, 11900, Penang Malaysia; Intel Technology Sdn. Bhd, Bayan Lepas Free Industrial Zone, 11900, Penang Malaysia; Intel Technology Sdn. Bhd, Bayan Lepas Free Industrial Zone, 11900, Penang Malaysia; Intel Technology Sdn. Bhd, Bayan Lepas Free Industrial Zone, 11900, Penang Malaysia","2007 IEEE/SEMI Advanced Semiconductor Manufacturing Conference","25 Jun 2007","2007","","","384","389","As semiconductor devices become more complex due to miniaturization and more integrated functions, the assembly and test manufacturing (ATM) processes and equipment become more complex as well. Predicting equipment capacity is no longer trivial, leading to the need for high fidelity dynamic equipment simulation models. This paper describes an approach to develop and apply high fidelity simulation models. Three case studies with different levels of model abstraction based on high-fidelity approach are discussed.","2376-6697","1-4244-0652-8","10.1109/ASMC.2007.375068","","https://ieeexplore-ieee-org.libraryproxy.his.se/stamp/stamp.jsp?arnumber=4259234","","Predictive models;Computational modeling;Power system modeling;Semiconductor devices;Costs;Logic;Manufacturing industries;Assembly;Semiconductor device testing;Manufacturing processes","equipment evaluation;Hi-Fi equipment;semiconductor device models","high fidelity simulation;accurate equipment;performance prediction;semiconductor devices;miniaturization;integrated functions;assembly;test manufacturing;dynamic equipment simulation","","","","11","","25 Jun 2007","","","IEEE","IEEE Conferences"
"Modeling of MMC-HVDC for grid integration applications","A. Carreno; M. Perez; M. Malinowski","Electronics Engineering Department, Universidad Tecnica Federico Santa Maria, Avenida Espana 1680, Valparaiso, Chile; Electronics Engineering Department, Universidad Tecnica Federico Santa Maria, Avenida Espana 1680, Valparaiso, Chile; Institute of Control and Industrial Electronics, Warsaw University of Technology, Koszykowa 75, 00-662 Warsaw, Poland","2017 IEEE Southern Power Electronics Conference (SPEC)","9 Apr 2018","2017","","","1","6","The large number of constitutive elements of modular multilevel converters requires a complex model for control and modulation simulation which usually requires a small step time in the range of microseconds. However, to study the interaction of the MMC-HVDC station with the electrical DC and AC systems, which dynamical response is in the range of seconds, requires a model more simple but without losing the main dynamical characteristics. This paper presents a simplified model which allows longer step time simulation retaining the main features of the modular multilevel converter. The complete model of MMC is introduced and sequentially simplified in order to achieve a given simulation step time. Simulation results of the different stages of simplification are given.","","978-1-5090-6425-0","10.1109/SPEC.2017.8333648","","https://ieeexplore-ieee-org.libraryproxy.his.se/stamp/stamp.jsp?arnumber=8333648","","Mathematical model;Capacitors;Voltage control;Modulation;Power system dynamics;Integrated circuit modeling;Harmonic analysis","HVDC power convertors;HVDC power transmission;power grids;voltage-source convertors","MMC-HVDC station;dynamical response;simplified model;modular multilevel converter;complete model;simulation results;grid integration applications;constitutive elements;complex model;modulation simulation;dynamical characteristics","","1","","14","","9 Apr 2018","","","IEEE","IEEE Conferences"
"Assessment of patient-physician assignment criteria in Emergency Department by using discret-event-simulation","M. Cildoz; F. Mallor; C. Azcarate; A. Ibarra","Public University of Navarre, Campus Arrosadia, Pamplona, 31006, SPAIN; Public University of Navarre, Campus Arrosadia, Pamplona, 31006, SPAIN; Public University of Navarre, Campus Arrosadia, Pamplona, 31006, SPAIN; Hospital of Navarre, Irunlarrea-Str. 3, Pamplona, 31008, SPAIN","2016 Winter Simulation Conference (WSC)","19 Jan 2017","2016","","","3680","3681","Physician's workload inequality in Emergency Departments (ED) is a relevant problem that affects their stress level, which influences the service quality and working conditions. The patient-physician assignment rule (PPAR) has a bearing on the physicians' workload, which has been studied in the Medical literature by performing interventions. These show that, contrary to basic models of queuing theory, automatic assignment of patients to physicians at triage (multiple queues model) reduces patient length of stay compared to self-assignment of patients by physicians (single queue allocation). Rotational PPAR facilitates the triage nurses' decision making and ensures an equal distribution of the number of patients, but it may not offset the differences in patients' severity and care needs, which lead to physicians' workload imbalance. Thus, such a problem has been addressed in a Spanish ED by developing a discrete-event-simulation model to assess different PPARs optimizing both criteria, patient's waiting time and physician's workload variability.","1558-4305","978-1-5090-4486-3","10.1109/WSC.2016.7822397","","https://ieeexplore-ieee-org.libraryproxy.his.se/stamp/stamp.jsp?arnumber=7822397","","Hospitals;Queueing analysis;Integrated circuit modeling;Resource management;Decision making;Complexity theory","decision making;discrete event simulation;health care;hospitals;queueing theory","discret event simulation;emergency department;ED;service quality;patient-physician assignment rule;PPAR;queuing theory;automatic patient assignment;queue allocation;decision making","","","","4","","19 Jan 2017","","","IEEE","IEEE Conferences"
"Calculation of complex permittivity for shielding effectiveness equivalence","M. Gao; Y. Xie; Q. Li; Y. Miao","State Key Laboratory of Electrical Insulation and Power Equipment, National Center for International Research on Transient, Electromagnetic Environments and Applications, School of Electrical Engineering, Xi'an Jiaotong University, Xi'an, Shaanxi, China; State Key Laboratory of Electrical Insulation and Power Equipment, National Center for International Research on Transient, Electromagnetic Environments and Applications, School of Electrical Engineering, Xi'an Jiaotong University, Xi'an, Shaanxi, China; State Key Laboratory of Electrical Insulation and Power Equipment, National Center for International Research on Transient, Electromagnetic Environments and Applications, School of Electrical Engineering, Xi'an Jiaotong University, Xi'an, Shaanxi, China; Beijing institute of space launch technology, Beijing, China","2017 IEEE International Conference on Environment and Electrical Engineering and 2017 IEEE Industrial and Commercial Power Systems Europe (EEEIC / I&CPS Europe)","13 Jul 2017","2017","","","1","5","In order to analyze and improve the shielding effectiveness of coating or metallic mesh, it is necessary to estimate the equivalent complex permittivity of multilayer materials based on the 3D-eIectromagnetic field simulation model or experiment results. A method is presented to calculate the complex permittivity for shielding effectiveness equivalence. Firstly, the simulation model of the multilayer material is established. After the process of wideband plane electromagnetic wave transmission, the magnitude and phase response in frequency domain are obtained. Secondly, based on the free space method, the equivalent complex permittivity of coating or metallic mesh in multilayer materials can be solved under necessary assumption. This method can be used to obtain the simplified model (even change the thickness of layer) with the same shielding effectiveness of multilayer materials, which can reduce the mesh density and the complexity in simulation. Additionally, it can be used to design the material structure that meet the shielding effectiveness requirements.","","978-1-5386-3917-7","10.1109/EEEIC.2017.7977829","","https://ieeexplore-ieee-org.libraryproxy.his.se/stamp/stamp.jsp?arnumber=7977829","Complex permittivity;multilayer material;metallic mesh;free space method;shielding effectiveness","Permittivity;Electromagnetic scattering;Electric fields;Frequency-domain analysis;Nonhomogeneous media;Glass;Permittivity measurement","electromagnetic shielding;frequency-domain analysis","complex permittivity;shielding effectiveness equivalence;3D-eIectromagnetic field simulation model;multilayer material;wideband plane electromagnetic wave transmission;multilayer materials","","","","8","","13 Jul 2017","","","IEEE","IEEE Conferences"
"Parameterization of fast and accurate simulations for complex supply networks","B. M. Duarte; J. W. Fowler; K. Knutson; E. Gel; D. Shunk","Dept. of Ind. Eng., Arizona State Univ., Tempe, AZ, USA; Dept. of Ind. Eng., Arizona State Univ., Tempe, AZ, USA; Dept. of Ind. Eng., Arizona State Univ., Tempe, AZ, USA; Dept. of Ind. Eng., Arizona State Univ., Tempe, AZ, USA; Dept. of Ind. Eng., Arizona State Univ., Tempe, AZ, USA","Proceedings of the Winter Simulation Conference","22 Jan 2003","2002","2","","1327","1336 vol.2","More efficient and effective control of supply networks is conservatively worth billions of dollars to the world economy. Adopting an approach by which the basic disciplines of industrial engineering, control engineering, system simulation and business re-engineering are integrated into one comprehensive system has been known to produce impressive results. This paper discusses a modular approach to develop a discrete event simulation model that has the appropriate level of abstraction to capture the inherent complexities that exist in a supply chain and is yet simple, fast and produces results of high fidelity. It discusses a method to parameterize each module by fine-tuning a few parameters to make it represent an entire factory, a warehouse or a transportation link.","","0-7803-7614-5","10.1109/WSC.2002.1166398","","https://ieeexplore-ieee-org.libraryproxy.his.se/stamp/stamp.jsp?arnumber=1166398","","Supply chains;Companies;Industrial engineering;Electronics industry;Fluctuations;Marketing and sales;Control engineering;Discrete event simulation;Transportation;Semiconductor device manufacture","discrete event simulation;supply chain management;production control","complex supply networks;parameterization;industrial engineering;control engineering;system simulation;business re-engineering;discrete event simulation model;abstraction;transportation link;warehouse;factory","","3","","26","","22 Jan 2003","","","IEEE","IEEE Conferences"
"Complexity-constrained trellis quantizers","M. F. Larsen; R. L. Frost","Dept. of Electr. & Comput. Eng., Brigham Young Univ., Provo, UT, USA; NA","IEEE Transactions on Information Theory","6 Aug 2002","1997","43","4","1134","1144","A reasonable measure of quantizer complexity is the expected number of quanta per input sample for which distortion is computed. Given this measure, a rate-distortion-complexity theory is obtained by extending earlier work in alphabet-constrained rate-distortion theory. Numerical results show that operation on the alphabet-constrained rate-distortion bound can be obtained with a complexity of two. Furthermore, Lloyd-Max conditions are shown to describe the minimum of a slightly constrained version of the rate-distortion-complexity problem. Complexity-constrained design methods are applied first to trellis-coded quantizers, where they are shown to reduce arithmetic operations by at least 25%. They are then used to develop model-based trellis quantizers, the trellises of which are derived from a Markov model of the source. Simulation results confirm that excellent performance can be obtained with modest complexity.","1557-9654","","10.1109/18.605574","","https://ieeexplore-ieee-org.libraryproxy.his.se/stamp/stamp.jsp?arnumber=605574","","Rate-distortion;Distortion measurement;Design methodology;Mutual information;Arithmetic;Source coding;Data compression;Laboratories;Computational complexity;Computational modeling","quantisation (signal);trellis codes;rate distortion theory;computational complexity;Markov processes","complexity-constrained trellis quantizers;quantizer complexity;rate distortion complexity theory;alphabet constrained rate distortion theory;Lloyd-Max conditions;complexity constrained design methods;trellis coded quantizers;arithmetic operations reduction;model based trellis quantizers;Markov model;simulation results;performance","","4","","21","","6 Aug 2002","","","IEEE","IEEE Journals"
"Simulation & modelling of a tungsten filament with COMSOL for electrothermal process","S. Cadar; E. Radu; T. Patarau; D. Petreus; F. S. Maxime","Department of Analytical Instrumentation Research, INCDO-INOE 2000, Research Institute for Analytical Instrumentation, Cluj-Napoca, Romania; Department of Applied Electronics, Technical University of Cluj-Napoca, Romania; Department of Applied Electronics, Technical University of Cluj-Napoca, Romania; Department of Applied Electronics, Technical University of Cluj-Napoca, Romania; Department of Applied Electronics, Technical University of Cluj-Napoca, Romania","2016 IEEE 22nd International Symposium for Design and Technology in Electronic Packaging (SIITME)","8 Dec 2016","2016","","","165","170","This paper presents the modeling and simulation of a tungsten filament using COMSOLE. The simulation results are compared with experimental data. The study consist in analyzing temperature variations for tungsten filaments (commercial bulb, 12V and 21W), correlated to low and high temperatures of metallic filaments used in electrothermal evaporation processes. The temperature measurement of metallic filaments is a complex process. A lot of factors have to be taken into account, like the resistance temperature dependency, the temperature behavior and the properties of the metal used to produce it, the emissivity and so on. The thermal effects can cause different problems or can introduce unwanted outcomes. One of the important issues is the modeling of this phenomena and interactions to build a reliable mathematical model for the behavior of a filament based on these factors. The main source of all heat transfers is the filament and there are different methods to determine its temperature such as optical methods and resistivity method.","","978-1-5090-4445-0","10.1109/SIITME.2016.7777269","","https://ieeexplore-ieee-org.libraryproxy.his.se/stamp/stamp.jsp?arnumber=7777269","simulation;modelling;COMSOL;tungsten;filament","Mathematical model;Plasma temperature;Temperature measurement;Tungsten;Temperature;Conductivity;Temperature dependence","filament lamps;mathematical analysis;temperature measurement;tungsten","resistivity method;optical methods;heat transfers;mathematical model;metallic filaments;temperature measurement;electrothermal evaporation;commercial bulb;electrothermal process;COMSOL;tungsten filament;voltage 12 V;power 21 W","","","","7","","8 Dec 2016","","","IEEE","IEEE Conferences"
