"3D GIS Integrated Model Simulation Algorithm Based on Block Model","J. Tao","Sch. of Econ. & Manage., Zhongyuan Univ. of Technol., Zhengzhou","2008 IEEE Pacific-Asia Workshop on Computational Intelligence and Industrial Application","20 Jan 2009","2008","1","","315","319","In order to organize and manage 3D GIS spatial data effectively, and represent 3D spatial entity integrally, a hybrid data structure model called BOT model (block octree tetrahedron model) is presented on basis of geological block model, which combines octree and tetrahedral network (TEN) structures. Using BOT generation algorithm, the block model is redivided with octree as general shape description and TEN as partial precise description, in which different gradation of grey are used to stand for different attributes of unit blocks. To reduce the memory space a linear BOT coding technology is proposed as well. The results of simulation experiments made with empirical data demonstrate that the BOT model holds merits of both octree and TEN and can represent 3D objects more effectively and precisely. Moreover, the algorithm simplifies modeling process and to a certain extent, reduces computing complexity for visualization.","","978-0-7695-3490-9","10.1109/PACIIA.2008.145","","https://ieeexplore-ieee-org.libraryproxy.his.se/stamp/stamp.jsp?arnumber=4756574","Block model;Octree;TEN;Delaunay triangulation;BOT model","Geographic Information Systems;Geology;Space technology;Data structures;Data models;Solids;Computational modeling;Computer network management;Technology management;Shape","computational geometry;data visualisation;geographic information systems;octrees;solid modelling","3D GIS integrated model simulation algorithm;block model;3D GIS spatial data management;3D spatial entity representation;block octree tetrahedron model;BOT data structure;geological block model;BOT generation algorithm;shape description;linear BOT coding technology;geographic information system;OpenGL visualization technology","","3","","8","","20 Jan 2009","","","IEEE","IEEE Conferences"
"Terms of application of ICs factorial models in optimal design procedures","I. Kazymyra; O. Kruk; Y. Sanotskyi","Inst. of Telecommun., Radioelectron. & Electron. Devices, Lviv Polytech. Nat. Univ., Ukraine; Inst. of Telecommun., Radioelectron. & Electron. Devices, Lviv Polytech. Nat. Univ., Ukraine; Inst. of Telecommun., Radioelectron. & Electron. Devices, Lviv Polytech. Nat. Univ., Ukraine","Proceedings of the International Conference Modern Problems of Radio Engineering, Telecommunications and Computer Science, 2004.","20 Dec 2004","2004","","","86","87","The terms of ICs factorial models' use in optimal circuit design procedures are considered in this paper. The ICs factorial models are the simplified models of circuits which are automatically synthesised on the basis of the design of computer simulation experiments with IC full mathematical model. Main destination of the synthesised factorial models is an effective search of trade-off solutions in the tasks of multi-objective optimization of IC. We consider the aspects of rightfulness of ICs output parameters approximation by bilinear and quadratic polynomials, the conditions of adequacy of ICs factorial models, their effectiveness on condition of complexity of ICs full model simulation.","","966-553-380-0","","","https://ieeexplore-ieee-org.libraryproxy.his.se/stamp/stamp.jsp?arnumber=1365879","","Integrated circuit modeling;Circuit synthesis;Integrated circuit synthesis;Predictive models;Equations;Constraint optimization;Polynomials;Nonlinear dynamical systems;Computer simulation;Mathematical model","integrated circuit modelling;integrated circuit design;circuit simulation;circuit optimisation;circuit complexity;digital simulation;mathematical analysis;polynomials","IC factorial models;optimal circuit design procedures;computer simulation;IC full mathematical model;trade-off solutions;multiobjective optimization;output parameters approximation;bilinear polynomials;quadratic polynomials;computational complexity","","","","9","","20 Dec 2004","","","IEEE","IEEE Conferences"
"Model abstraction of 3D-integrated/interposer-based high performance systems for faster (thermal) simulation","A. Heinig; D. Papaioannou; R. Fischbach","Fraunhofer Institute for Integrated Circuits, Design Automation Division, Zeunerstrasse 38, 01069, Dresden, Germany; Fraunhofer Institute for Integrated Circuits, Design Automation Division, Zeunerstrasse 38, 01069, Dresden, Germany; Fraunhofer Institute for Integrated Circuits, Design Automation Division, Zeunerstrasse 38, 01069, Dresden, Germany","2016 15th IEEE Intersociety Conference on Thermal and Thermomechanical Phenomena in Electronic Systems (ITherm)","21 Jul 2016","2016","","","230","237","Complex, high-integrated and high-performance microelectronic systems that include an interposer-solution become more and more dominant in the field of advanced 2.5/3D system integration. In such systems, for example required in network and image processing applications, the different ICs (e.g. processors and memories) are placed on a silicon interposer, which allow shorter interconnect lines between the elements, improving the signal transmission. The example system used throughout this paper combines an ASIC for signal processing with a high-performance memory. These two chips are placed as bare dies side-by-side on a silicon interposer using copper pillars. The interposer itself is located on a PCB. The good thermal conductivity of the copper structures within the interposer (i.e., top and bottom metal layers and the through-silicon-vias), in combination with the copper pillars underneath the dies, enable a high-performance and effective thermal behavior of the system; the heat produced by the processor and memory dies is dissipated through these elements to the PCB substrate that supports the system. However, in complex microelectronic systems that include arrays of different metal layers, TSVs, copper pillars, solder balls etc., their modeling and simulation can be an expensive procedure. This is especially a problem in early design phases where many different technologies options (e.g., packaging variants) have to be evaluated. Moreover, a real design exploration can be time consuming in many cases. In order to simplify the modeling procedure and speed up simulation, we present an alternative approach to derive simulation models from system descriptions, reduce the simulation time, and ensure the reliability of the obtained results. The array of copper pillars of the system is substituted with simplified blocks with the same volume and material properties. In terms of simulation, the meshing of cuboids and rectangular blocks is easier than meshing cylinders or spheres. The simulation time of the simplified model can be significantly reduced. First simplifications already result in 10-15% shorter simulation time (down to 2 mins reduction). The obtained numerical results are similar to the ones extracted prior to the aforementioned simplifications; the value deviation ranged between 1.5-3% for simulation cases up to 10 W applied power. However, the possible degree of simplification is strongly dependent on the application specific boundary conditions. As an example, for high-power applications; by further increasing the applied power, larger deviations can be observed (up to 7.8% for 25 W power, according to our simulation). Additionally, we propose an efficient solution in order to simulate the hot-spots inside the dies; they are performing complex and high-speed functions that result in heat concentration at specific points of the IC. Finally, another important parameter examined is the influence of the thermal interface material (TIM) in the behavior of the system with respect to the heat dissipated through the system if a heat-sink is included in the model.","1087-9870","978-1-4673-8121-5","10.1109/ITHERM.2016.7517555","","https://ieeexplore-ieee-org.libraryproxy.his.se/stamp/stamp.jsp?arnumber=7517555","high-speed dies;interposer;heat-sink;thermal behavior;heat distribution;power dissipation;thermal interface materials;copper pillars;thermal conductivity","Heating;Copper;Program processors;Substrates;Silicon;Integrated circuit modeling;Thermal conductivity","application specific integrated circuits;copper;elemental semiconductors;heat sinks;integrated circuit interconnections;integrated circuit modelling;integrated memory circuits;materials properties;microprocessor chips;printed circuits;signal processing;silicon;solders;thermal analysis;thermal conductivity;three-dimensional integrated circuits","TIM;heat-sink;thermal interface material;heat concentration;meshing cylinders;material properties;solder balls;PCB substrate;memory dies;processor dies;TSV;through-silicon-vias;thermal conductivity;copper pillars;high-performance memory;signal processing;ASIC;signal transmission;interconnect lines;silicon interposer;image processing applications;3D system integration;2.5 system integration;interposer-solution;microelectronic systems;thermal simulation","","1","","14","","21 Jul 2016","","","IEEE","IEEE Conferences"
"Controlled simplification of material flow simulation models","D. Huber; W. Dangelmaier","Business Computing, esp. CIM, Heinz Nixdorf Institut, Fürstenallee 11, Paderborn, 33102, Germany; Business Computing, esp. CIM, Heinz Nixdorf Institut, Fürstenallee 11, Paderborn, 33102, Germany","Proceedings of the 2009 Winter Simulation Conference (WSC)","11 Mar 2010","2009","","","839","850","In this paper a method for controlled simplification is presented, which is able to create simplified models with specific properties concerning complexity and behavioral deviation automatically. The method requires a finite set of model component classes, of which instances a user-defined model can be created. Two techniques for simplification are used: aggregation, where a large set of components is substituted by a small set, and omission, where components are deleted without compensation. A set of simplification rules concerning the simplification techniques, the component classes and the model structures line and parallel line are defined. These rules are used by a simplification algorithm, which is embedded in a control loop of complexity measurement and behavior measurement.","1558-4305","978-1-4244-5771-7","10.1109/WSC.2009.5429707","","https://ieeexplore-ieee-org.libraryproxy.his.se/stamp/stamp.jsp?arnumber=5429707","","Computational modeling;Runtime;Discrete event simulation;Fluid flow measurement;Size measurement;Electrostatic precipitators;Computer integrated manufacturing;Automatic control;Size control;Application software","compensation;computational complexity;discrete event simulation;materials requirements planning","controlled simplification;material flow simulation models;behavioral deviation;model component classes;user-defined model;compensation;simplification rules;simplification techniques;simplification algorithm;control loop;complexity measurement;behavior measurement","","8","","14","","11 Mar 2010","","","IEEE","IEEE Conferences"
"Reduced simulation model for flow analysis in a sawmill internal supply chain","P. Thomas; M. Suhner; A. Thomas","Université de Lorraine, CRAN, UMR 7039, Campus Sciences, BP 70239, 54506 Vandœuvre-lès-Nancy cedex, France; Université de Lorraine, CRAN, UMR 7039, Campus Sciences, BP 70239, 54506 Vandœuvre-lès-Nancy cedex, France; Université de Lorraine, CRAN, UMR 7039, Campus Sciences, BP 70239, 54506 Vandœuvre-lès-Nancy cedex, France","2015 International Conference on Industrial Engineering and Systems Management (IESM)","14 Jan 2016","2015","","","1319","1328","Accurate and simple simulation flow model is useful to make decision at the right time to manage supply chain or workshop. To do that, different reduction model complexity approaches have been proposed. One of them is to associate discrete event model of bottlenecks and continuous model of other work centers according to the theory of constraints. The continuous approximation is used only do determine how the bottlenecks are fed. Different continuous model have been proposed in the past. This paper focuses on the association of regression trees and neural networks in order to benefit of the advantages of each other. This approach is used for the modeling of a sawmill workshop and the results are compared with those obtained previously by using only CART model or neural network model.","","978-2-9600-5326-5","10.1109/IESM.2015.7380323","","https://ieeexplore-ieee-org.libraryproxy.his.se/stamp/stamp.jsp?arnumber=7380323","Decision tree;CART;reduced model;neural network;simulation;supply chain;learning","Adaptation models;Optical wavelength conversion;Regression tree analysis;Artificial neural networks;Computational modeling;Conferences","computational complexity;neural nets;regression analysis;supply chain management;trees (mathematics)","reduced simulation model;sawmill internal supply chain;simulation flow model;supply chain management;workshop management;reduction model complexity approach;discrete event model;continuous work-center model;continuous approximation;regression trees;neural networks","","1","","22","","14 Jan 2016","","","IEEE","IEEE Conferences"
"Reduced order modeling in FDTD with provable stability beyond the CFL limit","X. Zhang; F. Bekmambetova; P. Triverio","The Edward S. Rogers Sr. Department of Electrical and Computer Engineering, University of Toronto, 10 King's College Road, ON M5S3G4, Canada; The Edward S. Rogers Sr. Department of Electrical and Computer Engineering, University of Toronto, 10 King's College Road, ON M5S3G4, Canada; The Edward S. Rogers Sr. Department of Electrical and Computer Engineering, University of Toronto, 10 King's College Road, ON M5S3G4, Canada","2016 IEEE 25th Conference on Electrical Performance Of Electronic Packaging And Systems (EPEPS)","30 Jan 2017","2016","","","99","102","The Finite-Difference Time-Domain (FDTD) method is widely used in signal and power integrity, applied electromagnetism, and physics. Unfortunately, its computational efficiency can be severely degraded for multiscale problems, where small and large features coexist. This scenario is common in signal and power integrity, because of the large aspect ratio of interconnects and power/ground planes. In this paper, we show how multiscale FDTD simulations can be accelerated with model order reduction. A detailed model for complex objects is first generated using a fine FDTD grid. The model is then compressed with model order reduction, and embedded into a main coarse grid. During this process, the stability limit of the reduced model can be also extended, enabling the use of a larger time step in the whole domain. Using a passivity argument, we are able to systematically guarantee the stability of the resulting scheme, which is a main novelty with respect to previous works. A numerical example with two reduced models shows the potential of the proposed ideas.","2165-4115","978-1-5090-6110-5","10.1109/EPEPS.2016.7835427","","https://ieeexplore-ieee-org.libraryproxy.his.se/stamp/stamp.jsp?arnumber=7835427","Finite-Difference Time-Domain;Model Order Reduction;CFL Limit Extension;Stability","Finite difference methods;Time-domain analysis;Stability analysis;Power system stability;Numerical stability;Mathematical model;Computational modeling","computational electromagnetics;finite difference time-domain analysis;numerical stability;reduced order systems","multiscale FDTD simulations;model order reduction;FDTD grid;passivity argument;Courant-Friedrichs-Lewy stability limit;power-ground planes;computational efficiency;finite-difference time-domain method;CFL limit;provable stability;reduced order modeling","","2","","12","","30 Jan 2017","","","IEEE","IEEE Conferences"
"Modelling of Complex Systems with AML as Realized in MIRO Project","S. Chipeaux; F. Bouquet; C. Lang; N. Marilleau","Lab. d'Inf., Univ. de Franche-Comte, Besancon, France; Lab. d'Inf., Univ. de Franche-Comte, Besancon, France; Lab. d'Inf., Univ. de Franche-Comte, Besancon, France; UMI 209 UMMISCO, IRD-UPMC, Bondy, France","2011 IEEE/WIC/ACM International Conferences on Web Intelligence and Intelligent Agent Technology","10 Oct 2011","2011","3","","159","162","In this paper, we propose a modeling approach for a spatial complex system. The targeted system is the city with its mobility patterns. The goal of MIRO project is to study service accessibility in the city. In fact, we simulate the city with multi agent systems using them to represent each part of the system(individuals, buildings, streets,). The MIRO team is composed by scientists of several domains (computer sciences, geography or economy), so we want to construct a model of the city to share knowledges of each domain. The next step, we will use verification approach in order to validate the model and then the simulator because we want to generate simulator from model. Thus, we propose a method for modeling such complex system. This method is based on AML (Agent Modeling Language) that is a language well adapted for modeling multi-agent systems. We, then, present a spatial AML meta-model coupled with a method. The use case is the MIRO project.","","978-1-4577-1373-6","10.1109/WI-IAT.2011.195","","https://ieeexplore-ieee-org.libraryproxy.his.se/stamp/stamp.jsp?arnumber=6040830","Simulation;agenda;model;Multi Agent System","Computational modeling;Unified modeling language;Cities and towns;Context modeling;Adaptation models;Multiagent systems;Analytical models","multi-agent systems;simulation languages","complex system modelling;MIRO project;multi-agent systems;agent modeling language","","6","","8","","10 Oct 2011","","","IEEE","IEEE Conferences"
"A co-design modeling approach for computer network systems","Weilong Hu; H. S. Sarjoughian","Arizona Center for Integrative Modeling & Simulation, Computer Science and Engineering Department, Arizona State University, Tempe, 85281-8809, U.S.A.; Arizona Center for Integrative Modeling & Simulation, Computer Science and Engineering Department, Arizona State University, Tempe, 85281-8809, U.S.A.","2007 Winter Simulation Conference","4 Jan 2008","2007","","","685","693","Co-design modeling is considered key toward handling the complexity and scale of network systems. The ability to separately specify the software and hardware aspects of computer network systems offers new capabilities beyond what is supported in modeling frameworks and tools such as NS-2 and OPNET. The DEVS/DOC simulation environment supports logical co-design specification based on the distributed object computing (DOC) abstract model. To overcome DEVS/DOC's lack of support for visual and persistent modeling, this paper presents SESM/DOC, a novel approach, which is based on the scaleable entity structure modeler (SESM), a component-based modeling framework. This approach supports logical, visual and persistent modeling. Modelers can develop software and hardware models separately and systematically integrate them to specify a family of computer network system designs. This paper details the SESM/DOC co-design modeling approach with the help of a search engine system example, and presents a discussion for future research directions.","1558-4305","978-1-4244-1305-8","10.1109/WSC.2007.4419662","","https://ieeexplore-ieee-org.libraryproxy.his.se/stamp/stamp.jsp?arnumber=4419662","","Computer networks;Hardware;Computational modeling;Distributed computing;Routing;Computer simulation;Software tools;Application software;Network synthesis;Network topology","computer networks;discrete event simulation;distributed object management;hardware-software codesign;object-oriented programming;telecommunication computing","co-design modeling approach;computer network system design;NS-2;OPNET;DEVS/DOC simulation environment;distributed object computing abstract model;scaleable entity structure modeler;component-based modeling framework;search engine system","","","","19","","4 Jan 2008","","","IEEE","IEEE Conferences"
"A tutorial on simulation modeling in six dimensions","P. A. Fishwick","University of Florida, Computer and Information Science & Engineering Department, Bldg. CSE, Room 301, Gainesville, Florida, USA","Proceedings of the 2012 Winter Simulation Conference (WSC)","21 Feb 2013","2012","","","1","12","Simulation involves modeling and analysis of real-world systems. This tutorial will provide a broad overview of the modeling practice within simulation by introducing the reader to modeling choices found using six dimensions: abstraction, complexity, culture, engineering, environment, and process. Modeling can be a daunting task even for the seasoned modeling and simulation professional, and so my goal is to introduce modeling in two ways: 1) to use one specific type of model (Petri Net) as an anchor for cross-dimensional discussion, and 2) to provide a follow up discussion, with additional non Petri Net examples, to clarify the extent of each dimension. For example, in the abstraction dimension, one must think about scale, refinement, and hierarchy when modeling regardless of the type of modeling language. The reader will come away with a broad framework within which to understand the possibilities of models and of modeling within the practice of simulation.","1558-4305","978-1-4673-4782-2","10.1109/WSC.2012.6465227","","https://ieeexplore-ieee-org.libraryproxy.his.se/stamp/stamp.jsp?arnumber=6465227","","Biological system modeling;Computational modeling;Abstracts;Complexity theory;Tiles;Petri nets;Mathematical model","digital simulation;modelling;Petri nets","modeling language;process dimension;environment dimension;engineering dimension;culture dimension;complexity dimension;abstraction dimension;cross-dimensional discussion;Petri net;real-world systems;simulation modeling tutorial","","","","21","","21 Feb 2013","","","IEEE","IEEE Conferences"
"The Study of the Effect of Magnetic Flux Concentrator to the Induction Heating System Using Coupled Electromagnetic-Thermal Simulation Model","T. Zhu; P. Feng; X. Li; F. Li; Y. Rong","Dept. of Mech. Eng., Tsinghua Univ., Beijing, China; Dept. of Mech. Eng., Tsinghua Univ., Beijing, China; Dept. of Mech. Eng., Tsinghua Univ., Beijing, China; Dept. of Mech. Eng., Tsinghua Univ., Beijing, China; Dept. of Mech. Eng., Worcester Polytech. Inst., Worcester, MA, USA","2013 International Conference on Mechanical and Automation Engineering","19 Sep 2013","2013","","","123","127","Induction heating is frequently used in the metalworking industry to heat metals for hardening, soldering, brazing, tempering and annealing. Due to its complexity, the using of simulation to analyze induction heating process could become very advantageous both in design and economic aspects. In this paper, an analytical model is established using commercial package Cedrat Flux® 10.3, and the model is verified by the experiments. After the establishment of analytical model, an analysis on the effect of magnetic flux concentrator was conducted.","","978-0-7695-4975-0","10.1109/MAEE.2013.40","","https://ieeexplore-ieee-org.libraryproxy.his.se/stamp/stamp.jsp?arnumber=6602153","Induction heating;simulation model;magnetic flux concentrator","Electromagnetic heating;Coils;Magnetic flux;Analytical models;Mathematical model;Magnetic fields;Equations","annealing;brazing;design engineering;hardening;induction heating;industrial economics;magnetic flux;metals;metalworking;production engineering computing;tempering","induction heating system;coupled electromagnetic-thermal simulation model;metalworking industry;hardening;soldering;brazing;tempering;annealing;design aspect;economic aspect;commercial package Cedrat Flux 10.3;analytical model;magnetic flux concentrator","","9","","6","","19 Sep 2013","","","IEEE","IEEE Conferences"
